{"version":"mesh.cos.delegation.v1","delegation_id":"D1","task_id":"T1","delegating_agent":"cos","accountable_agent":"cro","business_objective":"Win qualified pursuit","expected_outcome":"Decision-ready pursuit","deliverable":"brief","success_criteria":["evidence-backed"],"priority":"P1","authority_level":3,"acceptance_test":"brief accepted","parent_task_id":null,"contributing_agents":[],"deadline":null,"evidence_supplied":[],"unresolved_evidence":[],"constraints":[],"permitted_actions":["commercial_analysis"],"prohibited_actions":["pricing_approval"],"approval_gates":["pricing"],"dependencies":[],"next_check_at":null,"escalation_condition":"material exception"}
